{"projection_id":"notion-projection-ahd-0001","schema_version":"1.0.0","integration_mode":"simulated","simulation_id":"sim-local-ahd-001","projected_at":"2026-08-19T09:13:00Z","source_event_id":"event-release-created-001","identity":{"tenant_id":"tenant-ahd","project_id":"project-ahd-demo","run_id":"run-ahd-demo-0001","step_id":"1","revision":1},"projection_role":"operative_projection","state_authority":"transition_service","atomic_state_writer":false,"records":[{"record_id":"project-ahd-demo","record_type":"project","title":"AHD Hausbesuch","projected_status":"awaiting_gate","source_revision":1,"source_event_id":"event-release-created-001"}]}
